[
  {
    "id": 1775960521888,
    "name": "Sixis Island",
    "lon": 130.988,
    "lat": 26.6462,
    "sea": "East Blue",
    "type": "Island",
    "arc": "One Piece Ace's Story",
    "notes": "A deserted island in East Blue where Portgas D. Ace was stranded after his ship was destroyed. He encountered Masked Deuce here, and after surviving together, Deuce became the first member of the Spade Pirates."
  },
  {
    "id": 1775960576973,
    "name": "Shimotsuki Village",
    "lon": 144.8635,
    "lat": 36.5991,
    "sea": "East Blue",
    "type": "Town",
    "arc": "Romance Dawn",
    "notes": "A small village in East Blue founded by Shimotsuki Kozaburo, who fled from Wano Country. It is home to Isshin Dojo where Roronoa Zoro trained alongside Kuina under Koushirou. Zoro's lifelong dream to become the world's greatest swordsman originated here."
  },
  {
    "id": 1775960721646,
    "name": "Kumate Island",
    "lon": 125.8916,
    "lat": 43.3705,
    "sea": "East Blue",
    "type": "Island",
    "arc": "Baratie",
    "notes": "An island in East Blue known for being inhabited by a violent cannibalistic tribe called the Kumate Tribe. Jango of the Black Cat Pirates claimed to have hypnotized the entire tribe during his travels. The island is only briefly mentioned and never shown in detail."
  },
  {
    "id": 1775960739428,
    "name": "Dawn Island",
    "lon": 135.6185,
    "lat": 53.4484,
    "sea": "East Blue",
    "type": "Island",
    "arc": "Romance Dawn",
    "notes": "The main island in the Goa Kingdom archipelago and the birthplace of Monkey D. Luffy. It contains Foosha Village, the Goa Kingdom capital, Grey Terminal, and Mt. Corvo. This island is central to Luffy's backstory and his childhood with Ace and Sabo."
  },
  {
    "id": 1775960773658,
    "name": "Goa Kingdom / Grey Terminal",
    "lon": 135.1398,
    "lat": 55.8688,
    "sea": "East Blue",
    "type": "Kingdom",
    "arc": "Post-War",
    "notes": "The Goa Kingdom is a monarchy on Dawn Island known for its corrupt nobility and rigid class system. Grey Terminal is the massive trash heap and slum outside its walls where outcasts live. Luffy, Ace, and Sabo built their secret base here and swore their brotherhood over sake."
  },
  {
    "id": 1775960803340,
    "name": "Foosha Village",
    "lon": 136.6964,
    "lat": 55.6798,
    "sea": "East Blue",
    "type": "Town",
    "arc": "Romance Dawn",
    "notes": "A peaceful port village on Dawn Island where Luffy spent his early childhood. It is home to Makino's bar, where the Red Hair Pirates frequently visited. Shanks gave Luffy his iconic straw hat here after Luffy was saved from the Lord of the Coast sea king."
  },
  {
    "id": 1775960842777,
    "name": "Mt. Corvo",
    "lon": 136.1395,
    "lat": 57.0597,
    "sea": "East Blue",
    "type": "Other",
    "arc": "Post-War",
    "notes": "A mountain on Dawn Island that serves as the hideout for the Dadan Family, a group of mountain bandits led by Curly Dadan. Garp entrusted both Ace and Luffy to Dadan's care, and this is where the two brothers along with Sabo grew up and trained together."
  },
  {
    "id": 1775960863299,
    "name": "Goat Island",
    "lon": 129.1846,
    "lat": 60.8883,
    "sea": "East Blue",
    "type": "Island",
    "arc": "Filler Arc",
    "notes": "An anime-only island that appears in filler episodes. It is inhabited by an old man named Zenny who lives alone with a herd of goats. The Straw Hats help him after discovering his dream to become a pirate. This location does not appear in the manga."
  },
  {
    "id": 1775961073197,
    "name": "Satsuruzu Kingdom",
    "lon": 140.2962,
    "lat": 66.1023,
    "sea": "East Blue",
    "type": "Kingdom",
    "arc": "Romance Dawn",
    "notes": "The home land of future Marine Koby. Two years prior to the events of the story, he had left on a fishing boat before accidentally boarding the ship of the Alvida Pirates where he was forced to work as a cabin boy."
  },
  {
    "id": 1775961172160,
    "name": "Nazawaka City",
    "lon": 149.8514,
    "lat": 70.2626,
    "sea": "East Blue",
    "type": "Town",
    "arc": "One Piece Novel ZORO",
    "notes": "Town  featured in the novel One Piece Novel Zoro."
  },
  {
    "id": 1775961307057,
    "name": "Nagagutsu Kingdom",
    "lon": 113.5829,
    "lat": 67.7937,
    "sea": "East Blue",
    "type": "Kingdom",
    "arc": "Levely",
    "notes": "Home of King Furrari and Prince Tritobu featured during the Levely in Mary Geoise"
  },
  {
    "id": 1775961347507,
    "name": "Shells Town / G-153",
    "lon": 124.9745,
    "lat": 61.706,
    "sea": "East Blue",
    "type": "Town",
    "arc": "Romance Dawn",
    "notes": "A port town in East Blue with the 153rd Marine Branch base. Luffy traveled here to recruit Roronoa Zoro, who was imprisoned by Captain Morgan's son Helmeppo. After defeating Morgan and freeing Zoro, this became the site of the Straw Hat Pirates' first official recruitment."
  },
  {
    "id": 1775961531623,
    "name": "G-77",
    "lon": 110.1873,
    "lat": 57.814,
    "sea": "East Blue",
    "type": "Marine Base",
    "arc": "Arlong Park",
    "notes": "During the early rule of Arlong on Conomi Islands, the G-77 branch had deployed units to to rescue the citizens. Ultimately failing and allowing Arlong's tyranny to grow."
  },
  {
    "id": 1775961554962,
    "name": "Organ Island / Orange Town",
    "lon": 100.9968,
    "lat": 51.4648,
    "sea": "East Blue",
    "type": "Town",
    "arc": "Orange Town",
    "notes": "An island in East Blue where Orange Town is located. The town was terrorized by Buggy the Clown and his pirate crew. Luffy and Zoro arrived here and recruited Nami after defeating Buggy. The mayor Boodle and his dog Chouchou are notable residents who defended their home."
  },
  {
    "id": 1775961628300,
    "name": "Island of Rare Animals",
    "lon": 93.8014,
    "lat": 47.2183,
    "sea": "East Blue",
    "type": "Island",
    "arc": "Syrup Village",
    "notes": "An island in East Blue inhabited by strange hybrid animals created by an eccentric scientist named Gaimon's absence. Gaimon himself is stuck in a treasure chest and guards what he believes are treasure boxes atop a cliff. Luffy visited briefly and left Gaimon to protect the animals."
  },
  {
    "id": 1775961658853,
    "name": "Tequila Wolf",
    "lon": 95.7191,
    "lat": 76.1135,
    "sea": "East Blue",
    "type": "Other",
    "arc": "Post-War",
    "notes": "A massive bridge in East Blue that has been under construction for over 700 years by order of the World Government. Slaves and criminals are forced to work there building the bridge toward an unknown destination. Robin was sent here by Kuma's powers and was later rescued by the Revolutionary Army."
  },
  {
    "id": 1775961697631,
    "name": "Gecko Islands",
    "lon": 77.0903,
    "lat": 50.3754,
    "sea": "East Blue",
    "type": "Archipelago",
    "arc": "Syrup Village",
    "notes": "An archipelago in East Blue consisting of multiple islands, with Syrup Village located on one of them. The islands are relatively peaceful and rural. This is the homeland of Usopp and where Kaya resides. The Black Cat Pirates targeted this location for Kaya's fortune."
  },
  {
    "id": 1775961718517,
    "name": "Syrup Village",
    "lon": 76.4342,
    "lat": 47.6978,
    "sea": "East Blue",
    "type": "Town",
    "arc": "Syrup Village",
    "notes": "A peaceful village on the Gecko Islands and the hometown of Usopp. Kaya, a wealthy young woman, lives in the mansion overlooking the village. Captain Kuro infiltrated the village as her butler Klahadore, planning to inherit her fortune. The Straw Hats defeated his Black Cat Pirates and recruited Usopp here."
  },
  {
    "id": 1775961779967,
    "name": "Mirror Ball Island",
    "lon": 75.293,
    "lat": 58.4791,
    "sea": "East Blue",
    "type": "Island",
    "arc": "Drum Island",
    "notes": "An island in East Blue known for its dance culture and festive atmosphere. Jango traveled here after the Black Cat Pirates disbanded and became famous as a dancer. He eventually joined the Marines alongside Fullbody after the two bonded over their shared love of dancing."
  },
  {
    "id": 1775961964274,
    "name": "G-16",
    "lon": 59.4506,
    "lat": 48.6,
    "sea": "East Blue",
    "type": "Marine Base",
    "arc": "Arlong Park",
    "notes": "Led by Captain Nezumi, tasked with protecting the Conomi Islands however under Arlong's rule through monthly payments by Arlong they had turned a blind eye to he is reign over the region."
  },
  {
    "id": 1775961987473,
    "name": "Gosa Village",
    "lon": 49.9311,
    "lat": 51.3262,
    "sea": "East Blue",
    "type": "Town",
    "arc": "Arlong Park",
    "notes": "A village in the Conomi Islands that was completely destroyed by Arlong and his Fish-Man Pirates as a demonstration of power. The village was flipped upside down, with buildings inverted into the ground. It serves as a grim reminder of Arlong's tyranny over the archipelago."
  },
  {
    "id": 1775962019443,
    "name": "Cocoyashi Village",
    "lon": 45.9788,
    "lat": 49.6104,
    "sea": "East Blue",
    "type": "Town",
    "arc": "Arlong Park",
    "notes": "Nami's hometown in the Conomi Islands where she grew up with her adoptive mother Bell-mère and sister Nojiko. The village suffered under Arlong's rule for eight years, with residents forced to pay tribute money to survive. Bell-mère was killed here when she couldn't pay for both herself and her daughters."
  },
  {
    "id": 1775962038955,
    "name": "Arlong Park",
    "lon": 44.1468,
    "lat": 52.0139,
    "sea": "East Blue",
    "type": "Other",
    "arc": "Arlong Park",